对话内容,真实意图
记得当年你创业最难的时候，我在你那儿可投了点心血啊。,提醒你现在的成功有他的功劳，该到他需要帮助的时候了。
我们家那口子总夸你能干，说办什么事都靠谱。,暗示最近有事情需要你帮忙，并且希望你像以前一样可靠地办成。
这房子装修得真不错，当年你买房，我还介绍过一位老师傅呢。,现在可能需要你提供其他帮助或资源。
你看我这对你，可比对自家亲戚还上心。,希望你记住这份“超额”人情并适时回报。
你表哥工作的事，当年我可是跑断了腿。,暗示现在需要你为他或他的家人办事作为回报。
咱两家这关系，说钱就外道了，当初互相帮衬都是应该的。,实则强调“互相帮衬”的长期性，暗示现在轮到你帮衬了。
我这个人啊，就记得谁对我好。,表达自己是个知恩图报的人，同时也提醒对方记得自己对他的好。
孩子以后找工作，还得靠你们这些有本事的叔叔多指点。,为未来提出铺垫性请求，暗示将来孩子求职时需要你的帮助。
那会儿你急用钱，我二话没说就转给你了。,提醒对方现在自己可能也有经济需求或需要支持。
老王那人不行，上次有事找他，推三阻四的。不像咱们。,通过贬低别人不帮忙，来抬高并暗示“咱们”之间应该互相帮忙。
我这人就是心软，看不得朋友为难。,标榜自己过去的付出，暗示对方不应让自己现在需要对方帮忙。
你如今混得好了，圈子也广了。,暗示你已经拥有更多资源，是时候利用这些资源来回报旧友了。
当年那个机会，我可是在领导面前力荐你的。,暗示现在需要你在某些事上支持他。
咱们这辈人，就是讲究个“有来有往”。,直接点明人情往来的核心规则，含蓄地提醒对方该“往”了。
我最近为这事啊，愁得都睡不好觉。,但期望对方能主动提出帮忙以还人情。
这孩子，做事越来越周到了。,对晚辈的成长和付出表示高度赞许和欣慰，比直接表扬更显亲切。
这件事办得，让人心里很暖和。,表达深深的感激和感动，认为对方的行为贴心、超出了预期。
钱不钱的不重要，难得的是这份心意。,强调情意比物质更珍贵，表达对对方用心的高度认可。
也就你能想到这儿了。,肯定对方的用心和重要性。
这顿饭吃得值，不光是为了吃饭。,暗示席间达成的共识或建立的情感连接比食物本身更有价值
你这朋友，我算没白交。,用“没白交”这个否定式表达，强烈肯定对方的义气和价值。
东西我用了，很好，费心了。,表示不仅收到而且认可礼物，并用“费心”二字含蓄表达谢意。
话不多说，都在心里了。,表示情感深厚，一切记在人情账里，是极重的承诺。
还是你考虑得周全，我都没想起来。,通过对比自己的疏忽，来突出和感谢对方思维的缜密与体贴。
有你在，我就放心了。,表达对对方能力和可靠性的绝对信任，是极高的评价和托付。
你这手艺，都快赶上老师傅了。,用类比名师的方式，给予对方技艺极高的、不直露的赞美。
咱们之间，不用搞那些虚的。,表面说不用客套，实则肯定双方关系牢固、实在，认可对方的真诚。
这件事让你受累了。,表达体恤和感谢，隐含“我记得这份辛苦”之意。
你这个情，我领了。,正式表示接受并铭记对方的人情馈赠，暗示未来会有所回报。
看来我是没看错人。,通过对当初选择的肯定，来表达对对方当下行为的极度满意和赞赏。
“哎呀，这怎么好意思收，快拿回去吧。”,若对方再坚持一下，就会收下；这是礼节性推辞，非真心拒绝。
“你来就来呗，还带东西干啥，太见外了！”,实际期待对方坚持留下礼物，体现彼此关系亲近但不失礼数。
“家里啥都不缺，你留着自己用吧。”,暗示若对方强调“一点心意”或“不值钱”，便会接受。
“上次你才来过，这次又破费，真不用！”,表面推辞，实则希望对方再次强调诚意后收下。
“你这不是让我难做人嘛，我怎么能收？”,暗示自己若收下会欠人情
“这么贵重的东西，我哪敢要啊！”,实为试探礼物价值是否合适，若对方轻描淡写说“不值什么”，便收下。
“你要是再这样，下次我都不敢上你家门了。”,用“不敢上门”反向施压，实则希望对方坚持，维持互惠关系。
“孩子都这么大了，你还惦记着，真不用操心。”,表面说孩子大了不用管，实则感激对方持续关照，若再递一次就收。
“你工作那么忙，还专门跑一趟，太麻烦你了。”,强调“麻烦”是客气，实则感动于对方用心，准备接受。
“这酒我喝不惯，你带回去吧。”,并非真不喝，而是等对方说“这是特意给你挑的”，便欣然收下。
“你这份心我领了，东西真不能要。”,“心领了”是过渡语，若对方再劝一句“就是点土产”，就会接受。
“我们两家谁跟谁啊，搞这些虚的干嘛。”,强调关系亲密，实则希望对方用“一点心意”化解“虚”，从而收下。
“你再这样我生气了啊！”,用“生气”作为最后防线，若对方笑着继续递，便笑着收下。
“我这儿正打算给你送点呢，你倒先来了。”,暗示互赠合理，为接受对方礼物铺垫台阶。
“你放这儿我也不好处理，还是你拿回去吧。”,“不好处理”是借口，若对方说“放冰箱就行”，便不再推辞。
“那年你爸住院，我还连夜骑车去送过汤呢。”,暗示你现在该回报我了，尤其在我有困难时。
“你结婚那会儿，我可是把压箱底的钱都拿出来了。”,提醒你曾受我大恩，如今轮到你帮我一把。
“上次你弟找工作，要不是我托老张，哪那么容易？”,暗示现在你该为我的事出力了。
“咱们从小一块长大，我啥时候亏待过你？”,强调过往情义，暗示你此刻不应推脱我的请求。
“你妈走的时候，里里外外都是我在张罗。”,提及重大付出，意在唤起你的责任感与回报义务。
“当年要不是我帮你担保，你能贷到那笔款？,提及风险性帮助（担保），暗示现在需要对方承担风险或出力
我对你可是没二话，现在我有难了...,对比过往"没二话"的付出，暗示现在对方也该"没二话"
你现在的日子好过了，可别忘了当初是谁拉你一把的,直接点出"拉一把"的恩情，要求对方现在"拉自己一把"
难为你还想着，不容易,比"谢谢"更重，暗含"你懂事了、有良心"的高度认可
你这孩子，总是这么周全,长辈对晚辈的最高评价，认可其处事周到、懂礼数
有这份心，比什么都强,淡化物质，强调心意，实则极度满意对方的用心
你办事，我放心,简短一句，传递深度信任，比长篇感谢更有分量
没白疼你,长辈对晚辈的极致认可，暗示过往的付出得到了回报
你比亲生的还贴心,将对方提升至"亲人"高度，是中式关系中的最高褒奖
这件事你办得漂亮，有章法,认可能力+态度，暗示对方可堪大用，值得深交
你是个知道冷暖的人,认可对方懂人情世故、知恩图报，是极高的评价
跟你打交道，踏实,用"踏实"形容，传递信任感和长期交往的意愿
你有这个悟性，以后错不了,长辈对晚辈的期许式认可，暗示已将其纳入"自己人"范畴
这件事你考虑得比我还周到,降低自己抬高对方，是中式社交中的高阶认可
你是个有后福的人,不直接夸现在，而是祝福未来，暗含"我愿意助你成福"
跟你合作，省心,职场/生意场中的高评价，暗示愿意长期合作
你这份情，我记下了,将对方的付出记为"情分"，承诺未来必回报，比"谢谢"更重
难得你这么有心，很难得,重复"难得"强调稀缺性，暗示对方的用心在自己这里分量极重
女儿频繁晚归，母亲晚饭时说：“最近小区晚上路灯坏了两盏，走夜路不太安全”,试探女儿晚归的安全性，不直接指责晚归，委婉表达牵挂
姐姐跟妹妹闲聊，说：“我家孩子生日，也就你还记得送礼物，其他人都忘了”,暗含委屈（觉得其他人不重视自己），也藏着对妹妹的认可
邻居敲门说：“我家老人睡眠不太好，晚上稍微有点动静就醒”,委婉提醒对方，家里晚上声音太大，影响到自家老人休息
超市结账时，前面的人对身后排队的人说：“我东西有点多，整理起来要慢一点”,委婉表达歉意，提醒身后的人耐心等待，避免对方产生不满
父亲看到儿子只穿一件薄外套出门，说：“今天楼下大爷出门，都穿羽绒服了”,用旁人的穿着传递“天气很冷”，暗含关心，提醒儿子注意保暖
同事看到对方一直盯着电脑加班，说：“我刚才去打水，看到茶水间有热乎的面包”,暗示对方该补充能量，关心对方的身体，避免直白提醒的生硬
母亲跟儿子打电话，说：“你爸最近总念叨，说好久没一起吃顿饭了”,试探儿子是否有时间回家，藏着父母对儿子的思念
闺蜜闲聊，说：“我上次遇到困难，找了好几个人，都没人愿意搭把手”,暗含委屈，期待闺蜜能主动关心、给予支撑
父亲对刚工作的儿子说：“你表哥刚工作半年，就给家里寄钱了”,暗示儿子可以学着回馈家里，表达对儿子的期待
奶奶跟孙女说：“这糕点真好吃，就是我牙口不好，没几口能吃的”,希望孙女以后能记得自己牙口不好，买适合自己的食物
陌生人在电梯里，对旁边玩手机的人说：“电梯里信号好像不太好，刷东西总卡顿”,委婉提醒对方，玩手机时可能手机声音太大影响他人
楼下邻居碰到楼上住户，说：“最近总听到头顶有咚咚的声音，我家孩子写作业容易分心”,提醒楼上住户，走路、搬东西的声音太大，影响到自家孩子学习
餐厅邻桌，客人对旁边大声说话的人说：“这家餐厅的环境还挺安静的，说话都能听得很清楚”,委婉提醒对方，说话声音太大，影响到了自己
快递员打电话说：“你家楼下的快递柜满了，我这边还有好几个件要送”,委婉提醒对方，尽快下楼取快递，避免自己多跑一趟
母亲看到女儿总熬夜刷手机，说：“最近楼下阿姨总说，熬夜多了容易没精神，脸色也不好”,借旁人的话传递熬夜的危害，暗含关心，提醒女儿早点休息
朋友看到对方总吃外卖，说：“我昨天自己做饭，放了点山药，吃着特别舒服”,用自己做饭的体验，暗示对方少吃外卖、注意饮食健康，传递关心
爷爷看到孙子背着沉重的书包，说：“这书包看着就沉，我年轻时背重点的东西，肩膀都疼”,用自己的经历暗示书包过重，关心孙子的肩膀，传递想帮忙的心意
室友看到对方忘记关窗户，说：“今天外面风挺大的，吹得窗帘都飘起来了”,避免直白提醒的尴尬，同时关心室内温度和物品安全
妈妈对下班后一直看手机的儿子说：“今天碰到你李阿姨了，她说她儿子每天下班都陪她散步聊天，可羡慕我了。”,实则表达对你回家后缺少交流的不满和失落，暗示希望你多陪伴和关心她。
姐姐对刚谈恋爱的妹妹说：“听说那个男生家里条件挺复杂的，他妈妈好像不太好相处。”,对妹妹的恋爱对象有所顾虑和担忧，委婉提醒妹妹要慎重考虑。
父亲在家庭聚餐时说：“我像你这么大的时候，早就自己攒钱把房子首付解决了。”,实则暗示你对未来缺乏规划，经济上不够独立，表达对你现状的焦虑和期待。
妻子对加班晚归的丈夫说：“孩子今天画了张全家福，画里只有我和他。”,实则表达因丈夫长期缺席家庭活动而感到的委屈，希望他能多花时间陪伴家人。
亲戚聚会时，姨妈对单身的你说：“我认识个特别优秀的孩子，跟你同年，现在都是公司主管了。”,实则试探你的感情状况，并暗示为你安排相亲的意愿，表达对你婚姻大事的关心。
邻居在楼道遇见时说：“你家阳台那几盆花长得真好，就是最近风大，偶尔有些叶子会飘到我家阳台。”,实则委婉提醒你家的植物落叶已经飘到他人区域，需要及时清理
陌生人在小区电梯里对牵着大型犬的你说：“这狗真帅气，看着挺有劲的，我小时候被狗追过，现在还有点怕。”,实则暗示你的狗体型较大，希望你能拉紧狗绳，保持距离，以免吓到他人。
楼上邻居下楼时碰面说：“最近是不是装修了？白天挺安静的，就是晚上偶尔能听到一点敲打声。”,实则提醒你家在晚上可能发出了某些噪音，影响到他人休息，希望注意时间安排。
社区保安巡逻时说：“最近有几户人家反映，看到陌生人在车位附近转悠，大家最好把贵重物品从车里拿出来。”,实则委婉提醒所有车主注意车内财物安全，暗示社区可能存在安全隐患。
邻居在扔垃圾时说：“现在垃圾分类要求越来越细了，我上次没分对还被提醒了，得好好学学。”,实则可能看到你垃圾分类有误，通过分享自身经历来间接提醒你正确分类的重要性。
家人看你连续出差回来后说：“天气预报说接下来一周都要下雨，出门记得带伞，别像上次那样淋感冒了。”,实则关心你身体，提醒你注意健康，并隐含对你之前不注意导致生病的轻微责备和心疼。
朋友见你脸色憔悴时说：“你最近是不是换新护肤品了？感觉皮肤状态有点不稳定，要多休息啊。”,实则注意到你疲惫憔悴的状态，通过谈论皮肤来委婉表达关心，并提醒你注意休息和健康。
同事看你中午又吃外卖时说：“楼下新开了家轻食店，听说食材挺新鲜的，要不要一起去试试？”,实则关心你的饮食健康，通过提议尝试新餐厅来间接建议你改善外卖饮食习惯。
长辈看你穿着单薄时说：“我这老寒腿一到这种天气就难受，你们年轻人现在不觉得，以后就知道厉害了。”,实则通过自身经历来提醒你注意保暖，表达对你会落下病根的担忧和关心。
妻子对丈夫说：“今天看到新闻，说一个程序员熬夜加班突然晕倒了，现在年轻人压力真大。”,实则担心丈夫工作太拼、熬夜太多，通过社会新闻来提醒他注意身体健康，避免过度劳累。
“你二姨昨天还问你什么时候带对象回来呢。”,借他人之口试探你感情进展，隐含催婚之意与对你单身状态的焦虑。
“你小时候生病，我三天没合眼守着你。”,在你近期疏于联系或未回应求助时提起旧事，暗含委屈与“你现在怎么不这样对我”的期待。
“你哥上个月给他丈母娘换了新冰箱，说老人用着顺手。”,用兄弟行为作参照，暗示你也该为父母改善生活条件，传递比较式期待。
“我手机又不会用了，算了，不麻烦你了。”,表面放弃求助，实则用“不麻烦”反向激发你的愧疚，希望你主动帮忙。
“你上次回家，待了不到俩小时就走了。”,陈述事实却语调低落，表达被敷衍的失落，试探你是否仍重视家庭团聚。
“你们家电动车充电线拉得有点长，怕不怕绊着人？”,实际担心线路横穿楼道存在安全隐患，也影响通行，但以“为你好”方式提出。
“最近快递柜老满，有些包裹放地上都淋湿了。”,暗指你常不及时取件，导致公共区域杂乱，委婉催促你尽快处理。
“我家猫最近总往你们阳台跑，是不是你们喂它了？”,实为提醒你不要随意投喂他人宠物，以免养成坏习惯或引发纠纷。
“这栋楼隔音是不太好，楼上走路声听得一清二楚。”,委婉指出你家（或你租户）脚步声/挪家具太响，已造成困扰。
“你家那盆绿萝长得真旺，都伸到我们窗台来了。”,表面夸植物，实则提醒枝叶越界影响自家采光或清洁，需修剪。
“你眼睛里都是红血丝，昨晚又赶方案了吧？”,并非单纯观察，而是心疼你过度劳累，隐含“该休息了”的劝诫。
“你妈炖了你爱喝的排骨汤，说你上次说想喝。”,强调“你说过想喝”，实则是母亲记挂你，借送汤催你回家或注意营养。
“你鞋跟都磨偏了，走路不硌脚吗？”,关注细节透露长期观察，真实意图是劝你别太节省，该换新鞋了。
“你爸今早量血压又高了，念叨你电话打得太少。”,将健康问题与联系频率挂钩，实则是双亲借身体状况唤起你的关注与陪伴。
“你上次说要体检，现在单位忙完了吧？”,表面确认工作进度，实则提醒你兑现对自己健康的承诺，别总拖延。
“你表姐昨天又带她爸妈去三亚了，说老人开心得睡不着。”,暗示你也该多陪父母出门走走，隐含对你疏于陪伴的委屈与期待。
“我这腰疼的老毛病，也就你爸记得给我买膏药。”,表面夸配偶，实则埋怨子女从未关心自己的身体状况。
“你小时候可黏我了，现在打电话都得预约。”,用今昔对比表达被冷落的失落，试探你是否还重视亲情。
“你弟昨晚又加班到十一点，饭都没吃上。”,表面陈述事实，实则暗示你作为兄长/姐姐不够关心弟弟，或希望你也更拼。
“你上次说要回来看我，结果又是下个月？”,用疑问语气掩饰失望，实则表达被一再爽约的不满与渴望见面。
“你们家阳台的花真好看，就是风大时土有点飘下来。”,实际是抱怨花盆土掉落弄脏自家晾晒衣物，但用赞美开头避免冲突。
“最近楼道灯好像不太亮，晚上看不清台阶。”,暗指你家堆在楼道的杂物遮挡了灯光，委婉要求清理。
“我家狗最近特别敏感，一有动静就叫个不停。”,实为提醒你深夜回家动静太大，已影响其休息。
“电梯里那股味道，是不是谁家饭菜溢出来了？”,委婉指出你家做饭油烟或垃圾气味扩散到公共区域。
“这栋楼停车真是越来越难了，有些车停得横七竖八。”,暗指你常把车斜停占位，影响他人出入，但不点名以留面子。
“你脸色有点发黄，是不是又熬夜打游戏了？”,表面问原因，实则强烈担忧你作息紊乱，催促你调整生活习惯。
“今天风这么大，穿这么少出门不怕感冒？”,并非单纯评论穿着，而是急切提醒你加衣，隐含心疼。
“你上次说胃不舒服，现在还吃辣吗？”,用细节回忆表达持续关注，实则劝你忌口、注意健康。
“你爸昨天念叨你手机关机好几次。”,不直接说“你失联让人担心”，而是借父亲之口传递焦虑与牵挂。
“你这包都脱线了，还能背啊？”,表面质疑物品状态，实则心疼你过得拮据或太将就，想帮你换新。
“这个想法挺有创意的，要不你先做个可行性分析、风险评估、跨部门协调方案，下周例会再议？”,让对方知难而退，实际并不支持该提议，但避免直接否定打击积极性。
“可以啊，只要你能搞定财务和法务那边的审批，我这边没问题。”,将执行难点转嫁给对方，暗示此事几乎不可能推进，从而婉拒。
“行，你要是真有把握，就写个详细计划报上来，我们按流程走。”,表面鼓励，实则用“流程”设卡，让对方因繁琐程序主动放弃。
“嗯，方向不错，不过得先看看有没有先例，最好找三个成功案例对标一下。”,以“缺乏依据”为由设置高门槛，实质是不认可但不愿明说。
“好主意！要不你牵头组织个专项小组？人手你自己协调。”,把责任和资源压力全压给对方，使其因无力承担而自行撤回。
“小王啊，最近是不是家里事情比较多？我看你提交的报告格式都不太规范了。”,暗示工作态度松懈、质量下降，借关心之名行批评之实。
“老李经验丰富，做事一向稳妥，咱们团队都得向他看齐。”,针对某人近期失误，通过表扬他人间接指出其不足。
“现在年轻人思维活跃是好事，但有些基本规矩还是得守住。”,批评下属越界或不守纪律，但用泛指回避点名，保全面子。
“上次那个项目，时间节点卡得特别紧，还好没出大问题。”,暗指对方在项目中险些酿成事故，提醒其今后谨慎行事。
“咱们单位讲究的是踏实肯干，花里胡哨的东西效果不一定好。”,针对下属过度包装或形式主义表现，委婉否定其工作方式。
“方案A和B各有优劣，你自己定，只要结果好就行。”,实际倾向方案A，但不说破，以便事后无论成败都能免责或揽功。
“客户那边你多沟通，怎么处理你觉得合适就怎么做。”,暗示应优先满足客户（即领导）未明说的偏好，若处理不当则责在下属。
“这次活动形式你们年轻人定，我不干涉，但要体现单位形象。”,用“单位形象”这一模糊标准框定方向，实则要求保守稳妥，不容创新冒进。
“预算有限，你灵活安排，总之不能超支，效果也不能差。”,设置矛盾目标，实则要求按领导心中既定方案执行，否则难辞其咎。
“你的想法很有创新性嘛！这样，你先按公司制度写个详细的可行性报告，再协调一下财务、法务、技术几个部门开个联席会初步论证一下，走一下预立项流程，让大家充分了解支持。”,这个想法不切实际/太麻烦，用繁琐的流程和跨部门协调的难度让你自己放弃。
“想调岗去业务部门锻炼是好事啊。我完全支持个人发展。不过你得先在本岗位找到能完全接替你的人，并且把他培养到领导认可的水平，确保我们部门工作不受任何影响。”,不想放走你这个得力干将，用“找到并培养出完美继任者”这个几乎不可能完成的条件来阻止你调岗。
“给项目额外申请预算？理解你们的困难。原则上可以，按公司规定，需要你这边提供过去三年同类型项目的投入产出比详细对比数据，并拿到至少三个以上副总裁的书面签字背书。”,不想给钱。设置一个数据难追溯、审批层级极高的门槛，让你知难而退。
“周末团建想带家属？这个提议很人性化嘛。那你们行政小组负责把全员家属的意愿、安全责任书、额外保险和活动方案细化一下吧，预算不能超，效果还要更好。”,觉得多一事不如少一事。通过将复杂化的组织责任和成本压力转移给提议者，使其主动撤回提议。
“你想独立负责这个模块？有闯劲是好的。不过公司有规定，需要你先通过架构师认证，并且有两次A级项目副负责人的成功经验。你可以先去准备，机会总是留给有准备的人。”,认为你目前能力不足或不信任你。用苛刻的硬性条件将当下的请求推迟到一个不确定的未来。
“最近**别的部门**的**小王**，那个项目报告写得又快又扎实，领导会上都表扬了，说体现了极高的责任心。”,批评你最近的工作报告拖沓、质量不高，缺乏责任心，需要你自我对照并改进。
“我看你们组最近气氛挺活跃的嘛，下午茶时间聊得挺开心。年轻团队就是有活力。”,提醒你们工作时间闲聊过多，影响了工作效率，需要注意工作纪律。
“今年公司整体效益不太好，很多部门都在优化结构、精简人员。我们部门目前还算稳定，大家要珍惜啊。”,警告你们要努力工作、创造价值，否则也可能面临岗位不保的风险，隐含了对当前绩效的不满。
“听说**上次那个项目**，客户私下夸我们接口的**老张**特别负责，一点小问题都追到底。这种口碑千金难买。”,批评你在项目中不够负责细致，没有主动跟踪和解决问题，要求你学习老张的态度。
“我像你这个年纪的时候，加班加点研究业务，生怕领导觉得我不上进。现在的年轻人条件好了，更懂得平衡生活了。”,暗示你工作不够努力、缺乏上进心，不如当年的他/她，需要更投入工作。
“这个活动方案，大的方向我觉得没问题。至于具体细节，你再琢磨琢磨，**看着办**吧，我相信你的判断。”,我对具体细节其实不满意或有特定想法，但我不明说。如果最终效果不好，责任在于你“没办好”。
“招聘新人的事，你全权负责。标准嘛，就按**能胜任我们部门高标准工作**的来，你把握。”,实际上有严格的隐形标准（如：要男生、要名校背景、要特定经验），但不明说。招来的人若不令我满意，便是你没理解好“高标准”。
